{
  "$schema": "https://bloktastic.dev/schema/bloktastic.schema.json",
  "name": "@bloktastic/announcement-bar",
  "type": "component",
  "version": "1.0.0",
  "title": "Announcement Bar",
  "description": "Slim top banner for product announcements, campaign messages, and urgent notices.",
  "author": {
    "name": "Bloktastic",
    "github": "bloktastic"
  },
  "compatibility": {
    "storyblok": ">=2.0.0",
    "frameworks": [
      "vue",
      "nuxt",
      "react",
      "nextjs",
      "astro",
      "svelte",
      "agnostic"
    ]
  },
  "tags": [
    "banner",
    "announcement",
    "marketing",
    "header"
  ],
  "category": "sections",
  "files": {
    "schema": "schema.json",
    "prompt": "prompt.md",
    "readme": "README.md"
  },
  "dependencies": {
    "bloktastic": []
  },
  "metadata": {
    "created": "2026-02-07",
    "updated": "2026-02-07",
    "status": "stable"
  }
}
