{
  "$schema": "https://bloktastic.com/schema/bloktastic.schema.json",
  "name": "@bloktastic/json-editor",
  "type": "plugin",
  "version": "1.0.0",
  "title": "JSON Editor",
  "description": "Field plugin with a syntax-highlighted JSON editor, schema validation, and collapsible tree view for structured data fields.",
  "author": {
    "name": "Bloktastic",
    "github": "bloktastic"
  },
  "compatibility": {
    "storyblok": ">=2.0.0",
    "frameworks": ["agnostic"]
  },
  "tags": ["json", "editor", "structured-data", "code", "field-plugin"],
  "category": "field-plugins",
  "files": {
    "readme": "README.md"
  },
  "links": {
    "storyblok-marketplace": "https://www.storyblok.com/marketplace",
    "docs": "https://www.storyblok.com/docs/plugins/field-plugins"
  },
  "metadata": {
    "created": "2026-02-28",
    "updated": "2026-02-28",
    "status": "maintained"
  }
}
