{
  "$schema": "https://bloktastic.com/schema/bloktastic.schema.json",
  "name": "@bloktastic/translation-hub",
  "type": "plugin",
  "version": "1.0.0",
  "title": "Translation Hub",
  "description": "Centralized translation workflow connector for TMS providers with job status and sync controls.",
  "author": {
    "name": "Bloktastic",
    "github": "bloktastic"
  },
  "compatibility": {
    "storyblok": ">=2.0.0",
    "frameworks": [
      "agnostic"
    ]
  },
  "tags": [
    "translation",
    "localization",
    "tms",
    "workflow"
  ],
  "category": "tool-plugins",
  "files": {
    "readme": "README.md"
  },
  "links": {
    "website": "https://lokalise.com/integrations/",
    "docs": "https://docs.lokalise.com/en/",
    "storyblok": "https://www.storyblok.com/docs/plugins/tool-plugins"
  },
  "metadata": {
    "created": "2026-02-07",
    "updated": "2026-02-07",
    "status": "maintained"
  }
}
