{
  "$schema": "https://bloktastic.dev/schema/bloktastic.schema.json",
  "name": "@bloktastic/footer",
  "type": "component",
  "version": "1.0.0",
  "title": "Footer",
  "description": "Multi-column footer with branding, navigation groups, legal text, and socials.",
  "author": {
    "name": "Bloktastic",
    "github": "bloktastic"
  },
  "compatibility": {
    "storyblok": ">=2.0.0",
    "frameworks": [
      "vue",
      "nuxt",
      "react",
      "nextjs",
      "astro",
      "svelte",
      "agnostic"
    ]
  },
  "tags": [
    "footer",
    "navigation",
    "legal",
    "links"
  ],
  "category": "navigation",
  "files": {
    "schema": "schema.json",
    "prompt": "prompt.md",
    "readme": "README.md"
  },
  "dependencies": {
    "bloktastic": []
  },
  "metadata": {
    "created": "2026-02-07",
    "updated": "2026-02-07",
    "status": "stable"
  }
}
