{
  "$schema": "https://bloktastic.com/schema/bloktastic.schema.json",
  "name": "@bloktastic/pricing-section",
  "type": "component",
  "version": "1.0.0",
  "title": "Pricing Section",
  "description": "Pricing block with nested pricing tiers and optional comparison context.",
  "author": {
    "name": "Bloktastic",
    "github": "bloktastic"
  },
  "compatibility": {
    "storyblok": ">=2.0.0",
    "frameworks": [
      "vue",
      "nuxt",
      "react",
      "nextjs",
      "astro",
      "svelte",
      "agnostic"
    ]
  },
  "tags": [
    "pricing",
    "plans",
    "conversion",
    "saas"
  ],
  "category": "sections",
  "files": {
    "schema": "schema.json",
    "prompt": "prompt.md",
    "readme": "README.md"
  },
  "dependencies": {
    "bloktastic": [
      "@bloktastic/pricing-tier"
    ]
  },
  "metadata": {
    "created": "2026-02-07",
    "updated": "2026-02-07",
    "status": "stable"
  }
}
