{
  "$schema": "https://bloktastic.dev/schema/bloktastic.schema.json",
  "name": "@bloktastic/cookie-consent-manager",
  "type": "plugin",
  "version": "1.0.0",
  "title": "Cookie Consent Manager",
  "description": "Field/tool plugin for GDPR-compliant cookie consent banners and preference storage.",
  "author": {
    "name": "Bloktastic",
    "github": "bloktastic"
  },
  "compatibility": {
    "storyblok": ">=2.0.0",
    "frameworks": [
      "agnostic"
    ]
  },
  "tags": [
    "cookie",
    "consent",
    "gdpr",
    "compliance"
  ],
  "category": "tool-plugins",
  "files": {
    "readme": "README.md"
  },
  "links": {
    "website": "https://github.com/bloktastic/cookie-consent-manager",
    "docs": "https://github.com/bloktastic/cookie-consent-manager#readme"
  },
  "metadata": {
    "created": "2026-02-07",
    "updated": "2026-02-07",
    "status": "maintained"
  }
}
