{
  "$schema": "https://bloktastic.dev/schema/bloktastic.schema.json",
  "name": "@bloktastic/stats-section",
  "type": "component",
  "version": "1.0.0",
  "title": "Stats Section",
  "description": "Section for key metrics and KPIs with nested stat items.",
  "author": {
    "name": "Bloktastic",
    "github": "bloktastic"
  },
  "compatibility": {
    "storyblok": ">=2.0.0",
    "frameworks": [
      "vue",
      "nuxt",
      "react",
      "nextjs",
      "astro",
      "svelte",
      "agnostic"
    ]
  },
  "tags": [
    "stats",
    "kpi",
    "metrics",
    "social-proof"
  ],
  "category": "sections",
  "files": {
    "schema": "schema.json",
    "prompt": "prompt.md",
    "readme": "README.md"
  },
  "dependencies": {
    "bloktastic": [
      "@bloktastic/stat-item"
    ]
  },
  "metadata": {
    "created": "2026-02-07",
    "updated": "2026-02-07",
    "status": "stable"
  }
}
