{
  "$schema": "https://bloktastic.com/schema/bloktastic.schema.json",
  "name": "@bloktastic/cdp-segment-audience-sync",
  "type": "plugin",
  "version": "1.0.0",
  "title": "CDP Segment Audience Sync",
  "description": "Sync campaign metadata and audience traits through Segment for activation pipelines.",
  "author": {
    "name": "Bloktastic",
    "github": "bloktastic"
  },
  "compatibility": {
    "storyblok": ">=2.0.0",
    "frameworks": [
      "agnostic"
    ]
  },
  "tags": [
    "segment",
    "cdp",
    "audiences",
    "analytics"
  ],
  "category": "tool-plugins",
  "files": {
    "readme": "README.md"
  },
  "links": {
    "website": "https://segment.com/docs/",
    "docs": "https://segment.com/docs/unify/",
    "storyblok": "https://www.storyblok.com/docs/plugins/tool-plugins"
  },
  "metadata": {
    "created": "2026-02-07",
    "updated": "2026-02-07",
    "status": "maintained"
  }
}
