{
  "$schema": "https://bloktastic.dev/schema/bloktastic.schema.json",
  "name": "@bloktastic/testimonial-item",
  "type": "component",
  "version": "1.0.0",
  "title": "Testimonial Item",
  "description": "Customer quote item with author details and optional avatar image.",
  "author": {
    "name": "Bloktastic",
    "github": "bloktastic"
  },
  "compatibility": {
    "storyblok": ">=2.0.0",
    "frameworks": [
      "vue",
      "nuxt",
      "react",
      "nextjs",
      "astro",
      "svelte",
      "agnostic"
    ]
  },
  "tags": [
    "testimonial",
    "quote",
    "social-proof",
    "review"
  ],
  "category": "content",
  "files": {
    "schema": "schema.json",
    "prompt": "prompt.md",
    "readme": "README.md"
  },
  "dependencies": {
    "bloktastic": []
  },
  "metadata": {
    "created": "2026-02-07",
    "updated": "2026-02-07",
    "status": "stable"
  }
}
