{
  "$schema": "https://bloktastic.dev/schema/bloktastic.schema.json",
  "name": "@bloktastic/advanced-color-picker",
  "type": "plugin",
  "version": "1.0.0",
  "title": "Advanced Color Picker",
  "description": "Field plugin offering palette presets, alpha support, and design token mapping.",
  "author": {
    "name": "Bloktastic",
    "github": "bloktastic"
  },
  "compatibility": {
    "storyblok": ">=2.0.0",
    "frameworks": ["agnostic"]
  },
  "tags": ["plugin", "field", "color", "design-tokens"],
  "category": "field-plugins",
  "files": {
    "readme": "README.md"
  },
  "links": {
    "website": "https://github.com/bloktastic/advanced-color-picker",
    "npm": "https://www.npmjs.com/package/storyblok-advanced-color-picker"
  },
  "metadata": {
    "created": "2026-02-07",
    "updated": "2026-02-07",
    "status": "maintained"
  }
}
