{
  "$schema": "https://bloktastic.com/schema/bloktastic.schema.json",
  "name": "@bloktastic/dam-adobe-aem-assets",
  "type": "plugin",
  "version": "1.0.0",
  "title": "DAM Adobe AEM Assets",
  "description": "Browse and attach Adobe Experience Manager Assets directly within Storyblok fields.",
  "author": {
    "name": "Bloktastic",
    "github": "bloktastic"
  },
  "compatibility": {
    "storyblok": ">=2.0.0",
    "frameworks": [
      "agnostic"
    ]
  },
  "tags": [
    "adobe",
    "aem-assets",
    "dam",
    "media"
  ],
  "category": "field-plugins",
  "files": {
    "readme": "README.md"
  },
  "links": {
    "website": "https://experienceleague.adobe.com/en/docs/experience-manager-cloud-service/content/assets/admin/integrate-assets-with-third-party",
    "docs": "https://experienceleague.adobe.com/en/docs/experience-manager-cloud-service/content/assets/home",
    "storyblok": "https://www.storyblok.com/docs/plugins/field-plugins"
  },
  "metadata": {
    "created": "2026-02-07",
    "updated": "2026-02-07",
    "status": "maintained"
  }
}
