{
  "$schema": "https://bloktastic.com/schema/bloktastic.schema.json",
  "name": "@bloktastic/search-algolia-sync",
  "type": "plugin",
  "version": "1.0.0",
  "title": "Search Algolia Sync",
  "description": "Index Storyblok content to Algolia with locale-aware records and near-real-time updates.",
  "author": {
    "name": "Bloktastic",
    "github": "bloktastic"
  },
  "compatibility": {
    "storyblok": ">=2.0.0",
    "frameworks": [
      "agnostic"
    ]
  },
  "tags": [
    "algolia",
    "search",
    "indexing",
    "discovery"
  ],
  "category": "tool-plugins",
  "files": {
    "readme": "README.md"
  },
  "links": {
    "website": "https://www.algolia.com/doc/",
    "docs": "https://www.algolia.com/doc/guides/sending-and-managing-data/send-and-update-your-data/",
    "storyblok": "https://www.storyblok.com/docs/plugins/tool-plugins"
  },
  "metadata": {
    "created": "2026-02-07",
    "updated": "2026-02-07",
    "status": "maintained"
  }
}
